[
  {
    "term": "DSG / S tronic",
    "aliases": [
      "dsg",
      "s tronic",
      "s-tronic",
      "dq200",
      "dq250",
      "dq381",
      "skrzynia dwusprzęgłowa"
    ],
    "category": "skrzynia",
    "short": "Automatyczna skrzynia dwusprzęgłowa grupy VW.",
    "explanation": "Skrzynia z dwoma sprzęgłami, która zmienia biegi bez przerwy w napędzie. Wersje „suche” (np. 7-biegowa DQ200) są wrażliwe na jazdę miejską i bywają kosztowne w naprawie (sprzęgło, mechatronika); wersje „mokre” (DQ250, DQ381) wymagają wymiany oleju co ok. 60 tys. km."
  },
  {
    "term": "Mechatronika",
    "aliases": [
      "mechatronika",
      "sterownik skrzyni",
      "tcm"
    ],
    "category": "skrzynia",
    "short": "Sterownik i układ hydrauliczny skrzyni automatycznej.",
    "explanation": "Moduł łączący elektronikę i hydraulikę, który steruje zmianą biegów w skrzyniach DSG/S tronic i innych automatach. Awaria objawia się szarpaniem, trybem awaryjnym lub brakiem biegów; regeneracja kosztuje zwykle kilka tysięcy złotych."
  },
  {
    "term": "Multitronic",
    "aliases": [
      "multitronic"
    ],
    "category": "skrzynia",
    "short": "Bezstopniowa skrzynia Audi (CVT) w autach z napędem na przód.",
    "explanation": "Skrzynia bez klasycznych biegów, stosowana w Audi A4/A6 z napędem na przód do ok. 2015 r. Wymaga regularnej wymiany oleju; zaniedbana szarpie przy ruszaniu i bywa droga w naprawie."
  },
  {
    "term": "Powershift",
    "aliases": [
      "powershift",
      "dps6",
      "6dct250",
      "6dct450"
    ],
    "category": "skrzynia",
    "short": "Dwusprzęgłowa skrzynia automatyczna Forda.",
    "explanation": "Wersja „sucha” (DPS6, m.in. Focus, Fiesta) jest znana z szarpania przy ruszaniu i usterek sterownika; wersja „mokra” (6DCT450, m.in. Mondeo, Kuga) jest trwalsza, ale wymaga wymiany oleju."
  },
  {
    "term": "EDC",
    "aliases": [
      "edc",
      "skrzynia edc"
    ],
    "category": "skrzynia",
    "short": "Dwusprzęgłowa skrzynia automatyczna Renault/Dacii.",
    "explanation": "Skrzynia z suchymi sprzęgłami (np. w Clio, Captur, Megane). Typowe objawy zużycia to szarpanie przy ruszaniu i drgania; przed zakupem warto sprawdzić ją w korku i odczytać błędy."
  },
  {
    "term": "CVT",
    "aliases": [
      "cvt",
      "skrzynia bezstopniowa",
      "multidrive s",
      "xtronic",
      "e-cvt"
    ],
    "category": "skrzynia",
    "short": "Skrzynia bezstopniowa – bez klasycznych biegów.",
    "explanation": "Zmienia przełożenie płynnie (np. Toyota Multidrive S, Nissan Xtronic). Wymaga oleju właściwego typu i jego wymiany; wycie, szarpanie lub „ślizganie” są sygnałem zużycia. Układ e-CVT w hybrydach Toyoty to inna, bardzo trwała konstrukcja."
  },
  {
    "term": "Easytronic / zautomatyzowana skrzynia manualna",
    "aliases": [
      "easytronic",
      "easy-r",
      "etg6",
      "skrzynia zautomatyzowana",
      "półautomat",
      "polautomat"
    ],
    "category": "skrzynia",
    "short": "Zwykła skrzynia manualna z automatycznie sterowanym sprzęgłem.",
    "explanation": "Tańsze rozwiązanie niż pełny automat (np. Opel Easytronic, Dacia Easy-R). Zmienia biegi wolno i z „przerwą”; zużywa sprzęgło i siłowniki, zwłaszcza w mieście."
  },
  {
    "term": "Koło dwumasowe (dwumasa)",
    "aliases": [
      "dwumasa",
      "koło dwumasowe",
      "kolo dwumasowe",
      "dmf"
    ],
    "category": "naped",
    "short": "Koło zamachowe tłumiące drgania silnika, zwykle w dieslach.",
    "explanation": "Element między silnikiem a sprzęgłem. Zużyte powoduje stuki i drgania na biegu jałowym oraz przy ruszaniu. Wymiana razem ze sprzęgłem kosztuje zwykle ok. 3–6 tys. zł."
  },
  {
    "term": "Sprzęgło Haldex / napęd 4x4",
    "aliases": [
      "haldex",
      "4motion",
      "quattro",
      "xdrive",
      "awd",
      "4x4",
      "4drive"
    ],
    "category": "naped",
    "short": "Układ dołączający napęd tylnej osi w autach 4x4.",
    "explanation": "W wielu autach (VW 4Motion, Audi quattro w mniejszych modelach, Skoda 4x4) tylna oś jest dołączana sprzęgłem Haldex, które wymaga wymiany oleju co ok. 60 tys. km. W BMW xDrive odpowiada za to skrzynia rozdzielcza – wrażliwa na różne opony na osiach."
  },
  {
    "term": "DPF / FAP",
    "aliases": [
      "dpf",
      "fap",
      "filtr cząstek stałych",
      "filtr czastek stalych",
      "filtr dpf"
    ],
    "category": "silnik",
    "short": "Filtr cząstek stałych w układzie wydechowym diesla.",
    "explanation": "Zatrzymuje sadzę, którą okresowo wypala (regeneracja). Przy jeździe głównie miejskiej się zapycha. Usunięcie filtra jest niezgodne z przepisami i może skutkować negatywnym wynikiem badania technicznego."
  },
  {
    "term": "Regeneracja DPF",
    "aliases": [
      "regeneracja dpf",
      "wypalanie dpf",
      "wypalanie filtra"
    ],
    "category": "silnik",
    "short": "Wypalanie sadzy z filtra cząstek stałych.",
    "explanation": "Odbywa się automatycznie podczas dłuższej jazdy. Przerywane regeneracje (krótkie trasy) mogą rozcieńczać olej paliwem – rośnie wtedy poziom oleju na bagnecie."
  },
  {
    "term": "EGR",
    "aliases": [
      "egr",
      "zawór egr",
      "zawor egr",
      "chłodnica egr",
      "chlodnica egr"
    ],
    "category": "silnik",
    "short": "Układ recyrkulacji spalin – zawraca część spalin do dolotu.",
    "explanation": "Obniża emisję tlenków azotu. Zawór i chłodnica EGR zarastają nagarem (spadek mocy, szarpanie, kontrolka); nieszczelna chłodnica powoduje ubytek płynu chłodzącego. Wyłączenie EGR jest niezgodne z przepisami."
  },
  {
    "term": "AdBlue / SCR",
    "aliases": [
      "adblue",
      "ad blue",
      "scr",
      "katalizator scr"
    ],
    "category": "silnik",
    "short": "Płyn i układ oczyszczania spalin w nowszych dieslach.",
    "explanation": "AdBlue to roztwór mocznika dolewany do osobnego zbiornika. Awaria pompy, grzałki lub czujników NOx wyświetla odliczanie kilometrów, po którym silnika nie da się uruchomić. „AdBlue off” to niezgodna z przepisami ingerencja."
  },
  {
    "term": "Rozrząd",
    "aliases": [
      "rozrząd",
      "rozrzad",
      "pasek rozrządu",
      "pasek rozrzadu",
      "łańcuch rozrządu",
      "lancuch rozrzadu"
    ],
    "category": "silnik",
    "short": "Mechanizm napędzający wałki rozrządu – pasek lub łańcuch.",
    "explanation": "Pasek wymienia się co określony przebieg lub lata (zwykle z pompą wody). Łańcuch teoretycznie jest bezobsługowy, ale w części silników rozciąga się (grzechotanie po zimnym starcie). Zerwanie zwykle niszczy silnik – warto mieć fakturę za wymianę."
  },
  {
    "term": "Pasek rozrządu w oleju",
    "aliases": [
      "pasek w oleju",
      "mokry pasek",
      "wet belt"
    ],
    "category": "silnik",
    "short": "Pasek rozrządu pracujący w kąpieli olejowej.",
    "explanation": "Rozwiązanie stosowane m.in. w Ford 1.0 EcoBoost i PSA 1.2 PureTech. Przy niewłaściwym oleju lub zbyt długich interwałach pasek się rozwarstwia, a jego fragmenty mogą zatkać smok pompy oleju."
  },
  {
    "term": "Wtryskiwacze piezo",
    "aliases": [
      "wtryskiwacze piezo",
      "piezo",
      "wtryskiwacze piezoelektryczne"
    ],
    "category": "silnik",
    "short": "Precyzyjne, szybkie wtryskiwacze w nowoczesnych dieslach i części benzyn.",
    "explanation": "Pracują dokładniej niż elektromagnetyczne, ale są droższe i trudniejsze w regeneracji. Objawy zużycia to trudny rozruch, nierówna praca i dymienie; stan ocenia się odczytem korekt dawek i testem przelewów."
  },
  {
    "term": "Wtrysk bezpośredni i nagar",
    "aliases": [
      "wtrysk bezpośredni",
      "wtrysk bezposredni",
      "nagar",
      "tsi",
      "tfsi",
      "gdi",
      "fsi",
      "cgi"
    ],
    "category": "silnik",
    "short": "Benzyna wtryskiwana prosto do cylindra; zawory dolotowe nie są myte paliwem.",
    "explanation": "W silnikach TSI/TFSI/GDI na zaworach dolotowych odkłada się nagar, co daje nierówną pracę i wypadanie zapłonów. Czyszczenie dolotu kosztuje zwykle ok. 800–2000 zł. Takie silniki są też bardziej wymagające przy montażu LPG."
  },
  {
    "term": "Turbosprężarka",
    "aliases": [
      "turbo",
      "turbosprężarka",
      "turbosprezarka",
      "turbina"
    ],
    "category": "silnik",
    "short": "Sprężarka napędzana spalinami, zwiększająca moc silnika.",
    "explanation": "Zużyta turbosprężarka gwiżdże, traci doładowanie lub przepuszcza olej (niebieski dym). Regeneracja to zwykle 1,5–4 tys. zł; ważne jest usunięcie przyczyny (np. zapchany przewód olejowy)."
  },
  {
    "term": "Klapy wirowe",
    "aliases": [
      "klapy wirowe",
      "swirl",
      "klapy kolektora"
    ],
    "category": "silnik",
    "short": "Klapki w kolektorze dolotowym poprawiające zawirowanie powietrza.",
    "explanation": "W części diesli (np. BMW M47, Opel 1.9 CDTI) mogą się urwać i uszkodzić silnik. Bywają usuwane lub zaślepiane – warto zapytać, czy zrobiono to fachowo."
  },
  {
    "term": "Downsizing (małe silniki turbo)",
    "aliases": [
      "downsizing",
      "ecoboost",
      "tce",
      "puretech",
      "1.0 turbo"
    ],
    "category": "silnik",
    "short": "Mała pojemność z turbodoładowaniem zamiast większego silnika.",
    "explanation": "Silniki takie jak 1.0 EcoBoost, 1.2 TCe czy 1.2 PureTech są oszczędne, ale bardziej wrażliwe na jakość oleju, przegrzanie i zaniedbania serwisowe niż proste, wolnossące jednostki."
  },
  {
    "term": "Instalacja LPG (sekwencyjna)",
    "aliases": [
      "lpg",
      "gaz",
      "sekwencja",
      "instalacja gazowa",
      "b+lpg"
    ],
    "category": "lpg",
    "short": "Zasilanie silnika gazem płynnym obok benzyny.",
    "explanation": "Instalacja sekwencyjna (IV generacji i nowsze) wtryskuje gaz osobno do każdego cylindra. Musi być wpisana do dowodu rejestracyjnego, wymaga corocznego badania technicznego oraz regularnej wymiany filtrów i regulacji."
  },
  {
    "term": "Butla LPG – homologacja",
    "aliases": [
      "butla",